<?xml version="1.0" encoding="UTF-8"?>
<xs:schema xmlns:xs="http://www.w3.org/2001/XMLSchema" elementFormDefault="qualified">

    <xs:element name="QLSINHVIEN">
        <xs:complexType>
            <xs:sequence>
                <xs:element maxOccurs="unbounded" name="SINHVIEN">
                    <xs:complexType>
                        <xs:sequence>
                            <xs:element name="MASV"/>
                            <xs:element name="TENSV"/>
                            <xs:element name="GIOITINH">
                                <xs:simpleType>
                                    <xs:restriction base="xs:string">
                                        <xs:pattern value="NAM|Ná»®"/>
                                    </xs:restriction>
                                </xs:simpleType>
                            </xs:element>
                            <xs:element name="NGAYSINH"/>
                            <xs:element name="MALOP">
                                <xs:simpleType>
                                    <xs:restriction base="xs:string">
                                        <xs:pattern value="[a-zA-Z][a-zA-Z][a-zA-Z][a-zA-Z][0-9][0-9]"/>
                                    </xs:restriction>
                                </xs:simpleType>
                            </xs:element>
                        </xs:sequence>
                    </xs:complexType>
                </xs:element>
            </xs:sequence>
        </xs:complexType>
    </xs:element>
</xs:schema>
